Nom de la manifestation;Région;Domaine;Complément domaine;Département;Périodicité;Mois habituel de début;Site web;N° Identification;Commune principale;Autres communes;N° de l'édition 2018;Date de création;Soutenu en 2017 par le ministère de la culture ;Soutenu en 2017 par le Centre national du cinéma ;Soutenu en 2017 par le Centre national du livre ;Soutenu en 2017 par le Centre national des variétés ;Soutenu en 2018 par le ministère de la culture ;Soutenu en 2018 par le Centre national du cinéma ;Soutenu en 2018 par le Centre national du livre ;Soutenu en 2018 par le Centre national des variétés ;Code postal;Code INSEE;coordonnees_insee;Libellé commune pour calcul CP, INSEE;Dépt SK;Nom Département;Commentaires;N° de l'édition 2019;Check édition;Mois indicatif en chiffre, y compris double mois;Mois indicatif;Date début ancien;Date de fin ancien;Soutien 2017 MCC à la structure;Part festival sur soutien à la structure;Enquête DRAC 2017
FESTIVAL DIVERSCENES;Pays de la Loire;Musiques actuelles;Musiques traditionnelles et du monde;53;Biennale années impaires;01 (janvier);http://diverscene.jimdo.com;LD085;CHANGE;Le Mans (72);;2011-01-01;;;;;;;;;53810;53054;48.1079801148,-0.800104772023;CHANGE;53.0;Mayenne;;29.0;-20.0;1.0;;2019-01-06;2019-02-02;;;
Paris des femmes;Île-de-France;Transdisciplinaire;;75;Annuelle;01 (janvier);www.parisdesfemmes.com;HA026;PARIS;;7.0;2012-01-01;;;;;;;;;75001;75101;48.8626304852,2.33629344655;PARIS 01;75.0;Paris;;8.0;0.0;1.0;;2019-01-10;2019-01-12;;;
FESTIVAL A PARTIR DU REEL;Normandie;Théâtre;;14;Annuelle;01 (janvier);https://www.larenaissance-mondeville.fr;IG002;MONDEVILLE;;4.0;2005-01-01;;;;;;;;;14120;14437;49.1693649378,-0.310691187417;MONDEVILLE;14.0;Calvados;Montant de la subvention non indiqué par la DRAC;15.0;0.0;1.0;;2019-01-10;2019-02-07;0;;
FESTIVAL TRACE;Île-de-France;Musiques actuelles;;92;Annuelle;01 (janvier);festivaltrace.com;;CHAVILLE;Nanterre (92)  /  Chatenay Malabry (92)  /  Issy Les Moulineaux (92)  /  Meudon (92)  / Antony (92)  /  Gennevilliers (92);18.0;2001-01-01;;;;;;;;;92370;92022;48.8076083562,2.19234061062;CHAVILLE;92.0;Hauts-de-Seine;;19.0;0.0;1.0;;2019-01-12;2019-02-16;;;
Festival International du Film de comédie de l’Alpe d’Huez;Auvergne-Rhône-Alpes;Cinéma et audiovisuel;;38;Annuelle;01 (janvier);http://www.festival-alpedhuez.com;AJ031;HUEZ;;21.0;1998-01-01;;;;;;;;;38750;38191;45.0969425761,6.08474810987;HUEZ;38.0;Isère;;22.0;0.0;1.0;;2019-01-15;2019-01-20;;;
SAINT-FONS JAZZ FESTIVAL;Auvergne-Rhône-Alpes;Musiques actuelles;Jazz, blues et musiques improvisées;69;Annuelle;01 (janvier);www.saint-fons-jazz.fr;AD227;ST FONS;;20.0;1999-01-01;;;;;;;;;69190;69199;45.7011050588,4.85046367008;ST FONS;69.0;Rhône;;21.0;0.0;1.0;;2019-01-22;2019-02-02;;;
FIPADOC;Nouvelle-Aquitaine;Cinéma et audiovisuel;Documentaire;64;Annuelle;01 (janvier);www.fipa.tv;JJ026;BIARRITZ;;31.0;1988-01-01;;oui;;;;;;;64200;64122;43.4695847227,-1.55309857519;BIARRITZ;64.0;Pyrénées-Atlantiques;En 2019, le Fipa poursuit son évolution en devenant FIPADOC, un festival international exclusivement consacré au documentaire audiovisuel.;32.0;0.0;1.0;;2019-01-22;2019-01-27;;;
FESTIVAL D'HUMOUR DE BOURG LA REINE;Île-de-France;Divers Spectacle vivant;Humour;92;Annuelle;01 (janvier);http://caelmjc.com;HH019;BOURG LA REINE;;23.0;1996-01-01;;;;;;;;;92340;92014;48.7799073627,2.31643010763;BOURG LA REINE;92.0;Hauts-de-Seine;;24.0;0.0;1.0;;2019-01-26;2019-02-02;;;
Fête du livre Saint-Paul-Trois-Châteaux;Auvergne-Rhône-Alpes;Livre et littérature;Livre de jeunesse;26;Annuelle;01 (janvier);https://www.fetedulivrejeunesse.fr/;AK008;ST Paul Trois Chateaux;;34.0;1985-01-01;;;oui;;;;;;26130;26324;44.3482808478,4.75744934383;ST Paul Trois Chateaux;26.0;Drôme;;35.0;0.0;1.5;;2019-01-30;2019-02-03;;;
Les Élancées, festival des arts du geste;Provence-Alpes-Côte d'Azur;Cirque et Arts de la rue;Cirque;13;Annuelle;02 (février);http://www.scenesetcines.fr/;MM007;ISTRES;;20.0;1999-01-01;;;;;;;;;13118;13047;43.5502689105,4.9511813524;ISTRES;13.0;Bouches-du-Rhône;;21.0;0.0;2.0;;2019-02-01;2019-02-10;;;
HIBERNAROCK;Auvergne-Rhône-Alpes;Musiques actuelles;Musiques amplifiées ou électroniques;15;Annuelle;02 (février);www.hibernarock.fr;AD182;AURILLAC;;12.0;2007-01-01;;;;;;;;;15000;15014;44.9245233686,2.44162453828;AURILLAC;15.0;Cantal;;13.0;0.0;2.0;;2019-02-02;2019-03-17;;;
Festival international du film documentaire océanien (FIFO);Polynésie française;Cinéma et audiovisuel;Documentaire;987;Annuelle;02 (février);https://www.fifotahiti.com/;SJ002;PAPEETE;;15.0;2004-01-01;;oui;;;;;;;98714;98735;-17.552056,-149.55886;PAPEETE;987.0;Polynésie française;;16.0;0.0;2.0;;2019-02-02;2019-02-10;;;
LES Z'ECLECTIQUES (COLLECTION HIVER);Pays de la Loire;Musiques actuelles;Musiques amplifiées ou électroniques;49;Annuelle;02 (février);www.leszeclectiques.com;LD999;Chemille en Anjou;Angers (49)  /  Cholet (49);;2011-01-01;;;;;;;;;49092;49120;47.3777256876,-0.609937724094;Chemille en Anjou;49.0;Maine-et-Loire;9ème édition des Z'éclectiques Collection Hiver, c'est un festival qui défend la découverte et l'émergence dans des lieux intimistes et à taille humaine.;9.0;0.0;2.0;;2019-02-06;2019-02-09;;;
Festival Filmer le travail;Nouvelle-Aquitaine;Cinéma et audiovisuel;;86;Annuelle;02 (février);http://filmerletravail.org/;JJ035;POITIERS;;9.0;2010-01-01;oui;;;;;;;;86000;86194;46.5839207726,0.359947653003;POITIERS;86.0;Vienne;;10.0;0.0;2.0;;2019-02-08;2019-02-17;;;
FESTIVAL ROUE WAROCH;Bretagne;Musiques actuelles;Musiques traditionnelles et du monde;56;Annuelle;02 (février);www.roue-waroch.fr;CD191;PLESCOP;;;1997-01-01;;;;;;;;;56890;56158;47.6973490259,-2.83080852214;PLESCOP;56.0;Morbihan;23ème édition du Festival Roue Waroch à Plescop. Le Roue Waroch est un festival mêlant culture bretonne et musiques traditionnelles du monde.;23.0;0.0;2.0;;2019-02-15;2019-02-17;;;
CLASSICOFRENZY (ex CLASSICOFOLIES);Occitanie;Musiques classiques;;46;Annuelle;02 (février);www.classicofolies.com;KE026;CAHORS;;;2015-01-01;;;;;;;;;46000;46042;44.4507370916,1.44075837848;CAHORS;46.0;Lot;;5.0;0.0;2.0;;2019-02-19;2019-04-19;;;
Festival Les Musicales Franco-Russes;Occitanie;Musiques classiques;;31;Annuelle;02 (février);;KE025;TOULOUSE;;;2019-01-01;;;;;;;;;31300;31555;43.5963814303,1.43167293364;TOULOUSE;31.0;Haute-Garonne;;1.0;0.0;2.0;;2019-02-22;2019-03-16;;;
CHAMPIONNAT NATIONAL DE BRASS BAND;Hauts-de-France;Musiques actuelles;Musiques traditionnelles et du monde;80;Annuelle;02 (février);https://www.brassband.cmf-musique.org/;GD120;AMIENS;;14.0;2005-01-01;;;;;;;;;80000;80021;49.9009532186,2.29007445539;AMIENS;80.0;Somme;;15.0;0.0;2.0;;2019-02-23;2019-02-24;;;
CERNUNNOS PAGAN FEST;Île-de-France;Musiques actuelles;Musiques amplifiées ou électroniques;77;Annuelle;02 (février);www.cernunnos-festival.fr;HD102;Noisiel;;;2009-01-01;;;;;;;;;77186;77337;48.8460926469,2.61997100426;Noisiel;77.0;Seine-et-Marne;;11.0;0.0;2.0;;2019-02-23;2019-02-24;;;
MARS EN BAROQUE;Provence-Alpes-Côte d'Azur;Musiques classiques;Baroque et ancien;13;Annuelle;02 (février);https://www.marsenbaroque.com;ME027;MARSEILLE;Saint Mitre les Remparts (13);16.0;2003-01-01;;;;;;;;;13001;13201;43.2999009436,5.38227869795;MARSEILLE 01;13.0;Bouches-du-Rhône;;17.0;0.0;2.0;;2019-02-26;2019-03-31;;;
CHANTONS SOUS LES PINS;Nouvelle-Aquitaine;Musiques actuelles;Chanson;40;Annuelle;03 (mars);www.chantonssouslespins.org;JD008;Pontonx sur l Adour;Mugron (40)  /  Soustons (40)  /  Luxey (40)  /  Vieux Boucau (40)  /  Pomarez (40) /  Leon (40)  /  Saint Vincent de Paul (40)  /  Bougue (40) /  Aurice (40)  /  Villeneuve de Marsan (40)  /  Gaas (40) /  Saint Sever (40)  /  Sabres (40);21.0;1998-01-01;;;;;;;;;40465;40230;43.7980252651,-0.940526888731;Pontonx sur l Adour;40.0;Landes;22ème édition;22.0;0.0;3.0;;2019-03-01;2019-03-31;;;
JAZZ DE MARS;Centre-Val de Loire;Musiques actuelles;Jazz, blues et musiques improvisées;28;Annuelle;03 (mars);www.jazzdemars.com;DD017;CHARTRES;Luisant (28)  /  Neron (28)  /  Nogent Le Rotrou (28)  / Chartres (28)  /  Vernouillet (28)  /  Saint Remy sur Avre (28)  /  Jouy (28)  /  Cloyes Sur Le Loir (28)  /  Maintenon (28)  /  Mainvilliers (28)  /  Brou (28)  /  Nogent le Phaye (28)  /  Gommerville (76)  /  Gallardon (28)  / Chateauneuf En Thymerais (28);;1995-01-01;;;;;;;;;28000;28085;48.4471464884,1.50570610616;CHARTRES;28.0;Eure-et-Loir;;25.0;0.0;3.0;;2019-03-02;2019-03-30;;;
FESTIVAL HUMOUR AU FEMININ A MARTIGNAS SUR JALLE;Nouvelle-Aquitaine;Divers Spectacle vivant;Humour;33;Annuelle;03 (mars);http://www.bordeaux-metropole.fr/Agenda/Festival-Humour-au-Feminin;JH039;MARTIGNAS SUR JALLE;;;1993-01-01;;;;;;;;;33127;33273;44.8450267218,-0.795499117928;MARTIGNAS SUR JALLE;33.0;Gironde;;27.0;0.0;3.0;;2019-03-02;2019-03-31;;;
Fête du livre de Bron;Auvergne-Rhône-Alpes;Livre et littérature;;69;Annuelle;03 (mars);http://www.fetedulivredebron.com/;AK006;BRON;;32.0;1987-01-01;;;oui;;;;;;69500;69029;45.7344856902,4.91168159471;BRON;69.0;Rhône;;33.0;0.0;3.0;;2019-03-06;2019-03-10;;;
British Screen / Ecrans Britanniques – Nîmes;Occitanie;Cinéma et audiovisuel;Cinémas étrangers;30;;03 (mars);http://ecransbritanniques.org;KJ007;NIMES;;;1998-01-01;;;;;;;;;30900;30189;43.844938394,4.34806796996;NIMES;30.0;Gard;;22.0;0.0;3.0;;2019-03-08;2019-03-17;;;
SPRING REGGAE FEST;Pays de la Loire;Musiques actuelles;Musiques amplifiées ou électroniques;72;Annuelle;03 (mars);www.irieites.net;LD084;ARNAGE;;12.0;2007-01-01;;;;;;;;;72230;72008;47.9292220095,0.191344248929;ARNAGE;72.0;Sarthe;;13.0;0.0;3.0;;2019-03-09;2019-03-09;;;
HARDKAZE FESTIVAL;Provence-Alpes-Côte d'Azur;Musiques actuelles;Musiques amplifiées ou électroniques;83;Annuelle;03 (mars);hardkaze.com;MD203;TOULON;;1.0;2018-01-01;;;;;;;;;83200;83137;43.1361589728,5.93239634249;TOULON;83.0;Var;2ème édition. Festival exclusivement dédié au Hardstyle, Rawstyle te Hardcore : 9 heures de show dans un grand spot indoor.;2.0;0.0;3.0;;2019-03-09;2019-03-09;;;
TENDANCES JAZZ;Hauts-de-France;Musiques actuelles;Jazz, blues et musiques improvisées;62;Annuelle;03 (mars);www.festival-cotedopale.fr;GD070;BOULOGNE SUR MER;Outreau (62)  /  Condette (62);26.0;1993-01-01;;;;;;;;;62200;62160;50.7271332663,1.60756334802;BOULOGNE SUR MER;62.0;Pas-de-Calais;27ème édition;27.0;0.0;3.0;;2019-03-12;2019-03-16;;;
LA TERRE EST A NOUS;Île-de-France;Musiques actuelles;Musiques traditionnelles et du monde;92;Annuelle;03 (mars);http://www.nanterre.fr/;HD148;NANTERRE;;4.0;2015-01-01;;;;;;;;;92000;92050;48.8960701282,2.20671346353;NANTERRE;92.0;Hauts-de-Seine;;5.0;0.0;3.0;;2019-03-13;2019-04-17;;;
LES PLURIELS;Normandie;Pluridisciplinaire Spectacle vivant;;76;Annuelle;03 (mars);www.lespluriels.com;IB006;ROUEN;;;1998-01-01;;;;;;;;;76000;76540;49.4413460103,1.09256784278;ROUEN;76.0;Seine-Maritime;22ème édition. Le Festival Les Pluriels est organisé par les étudiants de la licence professionnelle Métiers de la Culture proposée par l'Université de Rouen. Le festival est porté par l'association Art & Fac basée à l'UFR Lettres et Sciences Humaines de Mont-Saint-Aignan.;22.0;0.0;3.0;;2019-03-13;2019-03-16;;;
MONTE DANS L'BUS;Pays de la Loire;Musiques actuelles;;53;Annuelle;03 (mars);www.6par4.com;LD138;LAVAL;Bonchamp, Changé, Saint-Berthevin;6.0;2013-01-01;;;;;;;;;53000;53130;48.0608565468,-0.766005687142;LAVAL;53.0;Mayenne;;7.0;0.0;3.0;;2019-03-13;2019-03-23;;;
Festival Lézard Ti Show;Martinique;Cirque et Arts de la rue;Arts de la rue;972;Annuelle;03 (mars);http://www.lezardtishow.fr/;QM001;LE CARBET;;9.0;2010-01-01;oui;;;;;;;;97221;97204;14.7110039815,-61.1647565483;CARBET;972.0;Martinique;;10.0;0.0;3.0;;2019-03-13;2019-03-17;;;
Vidéoformes – festival international d’arts numériques de ClermontFerrand;Auvergne-Rhône-Alpes;Transdisciplinaire;Création numérique;63;;03 (mars);https://videoformes.com/;AA012;CLERMONT FERRAND;;;1986-01-01;oui;;;;;;;;63100;63113;45.7856492991,3.11554542903;CLERMONT FERRAND;63.0;Puy-de-Dôme;;34.0;0.0;3.0;;2019-03-14;2019-03-17;;;
ELECTROCHIC;Île-de-France;Musiques actuelles;Musiques amplifiées ou électroniques;78;Annuelle;03 (mars);http://www.festivalelectrochic.fr/;HD125;Velizy Villacoublay;Jouy en Josas (78)  /  Versailles (78)  /  Saint Cyr L'ecole (78);;2017-01-01;;;;;;;;;78140;78640;48.783985823,2.19707485523;Velizy Villacoublay;78.0;Yvelines;Pour la troisième année, le festival Electrochic fait vibrer le territoire de Versailles Grand Parc au son de la musique électro.;3.0;0.0;3.0;;2019-03-14;2019-03-17;;;
PARIS MUSIC;Île-de-France;Musiques actuelles;;75;Annuelle;03 (mars);www.paris-music.com;HD229;PARIS;;3.0;2016-01-01;;;;;;;;;75001;75101;48.8626304852,2.33629344655;PARIS 01;75.0;Paris;4ème édition. Créé par les organisateurs du « Disquaire Day » en association avec la Mairie de Paris, le nouveau Festival « Paris Music » se donne pour ambition de devenir chaque année un rendez-vous incontournable et d'offrir une voix importante à Paris au sein de la création musicale internationale.;4.0;0.0;3.0;;2019-03-14;2019-03-16;;;
Festival de Guitare d’Aucamville et du Nord Toulousain;Occitanie;Musiques actuelles;;31;Annuelle;03 (mars);www.guitareaucamville.com;KD256;AUCAMVILLE;Gagnac sur Garonne (31)  /  Castelginest (31)  /  Fonbeauzard (31)  /  Fenouillet (31)  /  Launaguet (31)  /  Bruguieres (31)  /  Aucamville (31) / Toulouse (31);;2009-01-01;;;;;;;;;31140;31022;43.6713968117,1.42370910767;AUCAMVILLE;31.0;Haute-Garonne;27ème édition. Festival de Guitare d'Aucamville est un événement musical de référence, profondément inscrit dans le territoire nord toulousain, et rayonnant bien au-delà des frontières de l'Occitanie pour tous les passionnés de guitare.;11.0;0.0;3.0;;2019-03-14;2019-04-06;;;
LES DETOURS DE BABEL;Auvergne-Rhône-Alpes;Pluridisciplinaire Musique;;38;Annuelle;03 (mars);www.detoursdebabel.fr;AC005;GRENOBLE;Varces-Allières-et-Risset, Échirolles, Fontaine, La Côte Saint André, La Tronche, Meylan, Romans-sur-Isère, Saint-Martin-d’Hères, Seyssinet-Pariset, Villeneuve-de-Marc, Voiron (38);8.0;2011-01-01;;;;oui;;;;;38000;38185;45.1821215167,5.72133051752;GRENOBLE;38.0;Isère;Issu en 2011 de la fusion du Grenoble Jazz Festival et des 38e Rugissants;9.0;0.0;3.0;;2019-03-15;2019-04-07;;;
BLUES AUTOUR DU ZINC;Hauts-de-France;Musiques actuelles;Jazz, blues et musiques improvisées;60;Annuelle;03 (mars);www.zincblues.com;GD053;BEAUVAIS;;23.0;1996-01-01;;;;;;;;;60000;60057;49.4365523321,2.08616123661;BEAUVAIS;60.0;Oise;;24.0;0.0;3.0;;2019-03-15;2019-03-23;;;
Festival Contes en Maisons;Île-de-France;Divers Spectacle vivant;Conte;77;Annuelle;03 (mars);www.fdfr77.org;HH042;BLANDY LES TOURS;Bombon, Nanteuil les meaux, Pécy, Veneus les sabons, Villers sous grez, Sivry Courtry, Rampillon, Fontainebleau, Melun, La Chapelle-Gauthier, Bois le Roi;6.0;2013-01-01;;;;;;;;;77720;77034;48.5601991238,2.79501080828;BLANDY LES TOURS;77.0;Seine-et-Marne;;7.0;0.0;3.0;;2019-03-15;2019-03-31;;;
LIÉVIN METAL FEST;Hauts-de-France;Musiques actuelles;Musiques amplifiées ou électroniques;62;Annuelle;03 (mars);https://arcenciel.lievin.fr/lievin-metal-fest-4eme-edition/;;LIEVIN;;;2016-01-01;;;;;;;;;62800;62510;50.4242782538,2.77291885384;LIEVIN;62.0;Pas-de-Calais;;4.0;0.0;3.0;;2019-03-15;2019-03-16;;;
ELECTROCHOC;Auvergne-Rhône-Alpes;Musiques actuelles;Musiques amplifiées ou électroniques;38;Annuelle;03 (mars);www.electrochoc-festival.com;AD111;BOURGOIN JALLIEU;;13.0;2006-01-01;;;;;;;;;38300;38053;45.6022027954,5.27393762111;BOURGOIN JALLIEU;38.0;Isère;14ème édition. Depuis 2005, la Scène de Musiques Actuelles a créé le festival dans un esprit de décloisonnement, d'expérimentation, de découverte et de diversité. Des idées fortes qui nourrissent depuis dix ans la démarche artistique du festival et des Abattoirs.;14.0;0.0;3.0;;2019-03-16;2019-03-30;;;
LES GIBOULEES;Bretagne;Cirque et Arts de la rue;Arts de la rue;35;Annuelle;03 (mars);http://festival-lesgiboulees.fr/;CM015;RENNES;;3.0;2016-01-01;;;;;;;;;35700;35238;48.1119791219,-1.68186449144;RENNES;35.0;Ille-et-Vilaine;;4.0;0.0;3.0;;2019-03-16;2019-03-17;;;
Grand festival contre le racisme, l’antisémitisme et la haine anti-LGBT;Île-de-France;Transdisciplinaire;;75;Annuelle;03 (mars);http://www.histoire-immigration.fr/;HA022;PARIS;;3.0;2016-01-01;;;;;;;;;75001;75101;48.8626304852,2.33629344655;PARIS 01;75.0;Paris;;4.0;0.0;3.0;;2019-03-16;2019-03-24;;;
Festival international du film d'Aubagne;Provence-Alpes-Côte d'Azur;Cinéma et audiovisuel;;13;Annuelle;03 (mars);www.aubagne-filmfest.fr;MJ018;AUBAGNE;;19.0;2000-01-01;oui;oui;;;;;;;13400;13005;43.2934843764,5.56331273477;AUBAGNE;13.0;Bouches-du-Rhône;;20.0;0.0;3.0;;2019-03-18;2019-03-23;;;
Festival 2 Valenciennes;Hauts-de-France;Cinéma et audiovisuel;;59;Annuelle;03 (mars);www.festival2valenciennes.com;GJ005;Valenciennes;;8.0;2011-01-01;oui;;;;;;;;59300;59606;50.3588666163,3.51567664819;Valenciennes;59.0;Nord;;9.0;0.0;3.0;;2019-03-19;2019-03-24;;;
Printemps du livre;Auvergne-Rhône-Alpes;Livre et littérature;;38;Annuelle;03 (mars);http://printempsdulivre.bm-grenoble.fr/;AK013;GRENOBLE;;16.0;2003-01-01;;;oui;;;;;;38000;38185;45.1821215167,5.72133051752;GRENOBLE;38.0;Isère;;17.0;0.0;3.0;;2019-03-20;2019-03-24;;;
FESTIVAL ELECTR()CUTION;Bretagne;Musiques actuelles;Jazz, blues et musiques improvisées;29;Annuelle;03 (mars);www.ensemblesillages.com;CD080;BREST;;5.0;2014-01-01;;;;;;;;;29200;29019;48.4004997828,-4.5027907853;BREST;29.0;Finistère;6ème édition des rencontres des instruments acoustiques et de l'électronique. Au programme : rencontres improbables entre instruments et dispositifs électroacoustiques, créations, exposition, concerts, conférences, rencontres...;6.0;0.0;3.0;;2019-03-20;2019-03-23;;;
FESTIVAL DE JAZZ TRADITIONNEL DE ROCHEGUDE;Auvergne-Rhône-Alpes;Musiques actuelles;Jazz, blues et musiques improvisées;26;Annuelle;03 (mars);www.ajtderochegude.com;AD321;Rochegude;;12.0;2007-01-01;;;;;;;;;26790;26275;44.2556674573,4.83716476858;Rochegude;26.0;Drôme;13ème édition du festival de swing taditionnel;13.0;0.0;3.0;;2019-03-22;2019-03-24;;;
SONIC PROTEST;Île-de-France;Musiques actuelles;Musiques amplifiées ou électroniques;75;Annuelle;03 (mars);www.sonicprotest.com;HD019;PARIS;Bagnolet (93)  /  Vanves (92);14.0;2005-01-01;;;;oui;;;;;75001;75101;48.8626304852,2.33629344655;PARIS 01;75.0;Paris;15ème édition;15.0;0.0;3.0;;2019-03-22;2019-04-06;;;
Festival international du film de femmes de Créteil;Île-de-France;Cinéma et audiovisuel;;94;Annuelle;03 (mars);www.filmsdefemmes.com;HJ058;CRETEIL;;40.0;1979-01-01;;oui;;;;;;;94000;94028;48.7837401836,2.45463530415;CRETEIL;94.0;Val-de-Marne;;41.0;0.0;3.0;;2019-03-22;2019-03-30;;;
FOLK EN SCENES;Pays de la Loire;Musiques actuelles;;44;Annuelle;03 (mars);www.mairie-trignac.fr;LD013;TRIGNAC;Besne (44) / Montoir de Bretagne;6.0;2013-01-01;;;;;;;;;44570;44210;47.3125328416,-2.20700045585;TRIGNAC;44.0;Loire-Atlantique;7ème édition. Le festival est organisé par les villes de Trignac, Montoir-de-Bretagne et Besné.;7.0;0.0;3.0;;2019-03-22;2019-03-24;;;
LOUNGE MUSIC FESTIVAL;Auvergne-Rhône-Alpes;Musiques actuelles;;74;Annuelle;03 (mars);www.lesgets.com;AD323;LES GETS;;8.0;2011-01-01;;;;;;;;;74260;74134;46.1542288253,6.66014566051;LES GETS;74.0;Haute-Savoie;9ème édition du Lounge Music Festival. Pendant près de deux semaines plus de 40 concerts gratuits sont organisés dans les différents établissements du village, générant une ambiance conviviale et décontractée partout dans les rues !;9.0;0.0;3.0;;2019-03-23;2019-03-31;;;
Festival Rue des livres;Bretagne;Livre et littérature;;35;Annuelle;03 (mars);www.festival-ruedeslivres.org;CK010;RENNES;;11.0;2008-01-01;;;;;;;;;35700;35238;48.1119791219,-1.68186449144;RENNES;35.0;Ille-et-Vilaine;;12.0;0.0;3.0;;2019-03-23;2019-03-24;;;
Entre les lignes - Salon du livre de Bondues;Hauts-de-France;Livre et littérature;;59;Annuelle;03 (mars);https://www.ville-bondues.fr/salondulivre/;GK007;Bondues;;20.0;1999-01-01;;;;;;;;;59910;59090;50.7096656233,3.09529083038;Bondues;59.0;Nord;;21.0;0.0;3.0;;2019-03-23;2019-03-24;;;
LE FESTIVAL DU BRUIT QUI PENSE;Île-de-France;Musiques classiques;;78;Annuelle;03 (mars);www.bruitquipense.com;HE028;Louveciennes;;3.0;2016-01-01;;;;;;;;;78430;78350;48.8590188206,2.11364039022;Louveciennes;78.0;Yvelines;4ème édition. Festival international de musique classique situé à Louveciennes.;4.0;0.0;3.0;;2019-03-23;2019-03-31;;;
LA SEMAINE DU ROCK;Occitanie;Musiques actuelles;Musiques amplifiées ou électroniques;31;Annuelle;03 (mars);www.progres-son.fr;KD090;TOULOUSE;;15.0;2004-01-01;;;;;;;;;31300;31555;43.5963814303,1.43167293364;TOULOUSE;31.0;Haute-Garonne;;16.0;0.0;3.0;;2019-03-25;2019-03-31;;;
Festival international de cinéma d'animation de Pontarlier;Bourgogne-Franche-Comté;Cinéma et audiovisuel;Animation;25;Annuelle;03 (mars);https://www.ccjb.fr/;BJ003;PONTARLIER;;10.0;2009-01-01;;;;;;;;;25300;25462;46.9119730882,6.38914602031;PONTARLIER;25.0;Doubs;;11.0;0.0;3.0;;2019-03-26;2019-03-31;;;
RENCONTRES INTERNATIONALES DE LA GUITARE A ANTONY;Île-de-France;Pluridisciplinaire Musique;;92;Annuelle;03 (mars);www.ville-antony.fr;HC010;ANTONY;;26.0;1993-01-01;;;;;;;;;92160;92002;48.7503412602,2.2993268102;ANTONY;92.0;Hauts-de-Seine;Pour cette 27e édition, elles plongeront à la fois dans les rythmes argentins et les sonorités des Balkans;27.0;0.0;3.0;;2019-03-27;2019-03-31;;;
FESTIVAL INTERNATIONAL JAZZ A MEGEVE;Auvergne-Rhône-Alpes;Musiques actuelles;Jazz, blues et musiques improvisées;74;Annuelle;03 (mars);https://www.jazzamegeve.com;AD188;MEGEVE;;3.0;2016-01-01;;;;;;;;;74120;74173;45.8401573581,6.62348394015;MEGEVE;74.0;Haute-Savoie;Cet hiver Megève fait perdurer sa relation avec le jazz qui lui est chère depuis des décennies à travers la 4ème édition du festival de jazz hivernal et international.;4.0;0.0;3.0;;2019-03-28;2019-03-30;;;
SUPER FLUX;Centre-Val de Loire;Pluridisciplinaire Musique;;37;Annuelle;03 (mars);https://www.letempsmachine.com/;DC005;TOURS;;5.0;2014-01-01;;;;;;;;;37000;37261;47.3986382281,0.696526376417;TOURS;37.0;Indre-et-Loire;"""Mouvant, pluriel, foisonnant, itinérant, ludique et innovant, ce festival invite des musiques inqualifiables et inclassables, avant tout surprenantes, électrisantes et passionnantes""";6.0;0.0;3.0;;2019-03-29;2019-03-31;;;
Festival de l'Astre;Île-de-France;Théâtre;;75;Annuelle;03 (mars);http://cie-astre.com/;HG009;PARIS;Montreuil (93) / Saint-Denis (93);5.0;2014-01-01;;;;;;;;;75001;75101;48.8626304852,2.33629344655;PARIS 01;75.0;Paris;;6.0;0.0;3.0;;2019-03-29;2019-05-26;;;
7 BIS CHEMIN DE TRAVERSE;Auvergne-Rhône-Alpes;Pluridisciplinaire Musique;;1;Annuelle;03 (mars);http://www.resonancecontemporaine.org;AC006;BOURG EN BRESSE;;13.0;2006-01-01;;;;;;;;;1000;1053;46.2051520382,5.24602125501;BOURG EN BRESSE;1.0;Ain;"14ème édition. ""7bis Chemin de Traverse"" est un rendez-vous pluridisciplinaire original et printanier tourné vers la création.";14.0;0.0;3.0;;2019-03-30;2019-04-14;;;
Salon du livre jeunesse d'Eaubonne;Île-de-France;Livre et littérature;Livre de jeunesse;95;Annuelle;03 (mars);www.valdoise-tourisme.com;HK017;EAUBONNE;;35.0;1984-01-01;;;;;;;;;95600;95203;48.9909940165,2.27800925488;EAUBONNE;95.0;Val-d'Oise;;36.0;0.0;3.0;;2019-03-30;2019-03-31;;;
CONNEXIONS FESTIVAL;Pays de la Loire;Transdisciplinaire;Culture hip hop;72;Annuelle;04 (avril);https://superforma.fr/festival-connexions;LA004;LE MANS;Allonnes;10.0;2009-01-01;;;;;oui;;;;72000;72181;47.9885256718,0.200030493539;LE MANS;72.0;Sarthe;;11.0;0.0;4.0;;2019-04-01;2019-04-30;;;
CHAMONIX UNLIMITED FESTIVAL;Auvergne-Rhône-Alpes;Musiques actuelles;Musiques amplifiées ou électroniques;74;Annuelle;04 (avril);http://www.chamonix-unlimited.com;AD061;CHAMONIX MONT BLANC;;3.0;2016-01-01;;;;;;;;;74400;74056;45.9309819111,6.92360096711;CHAMONIX MONT BLANC;74.0;Haute-Savoie;Au pied du Mont-Blanc, Chamonix est un des sites naturels les plus visités au monde. Berceau du ski et de l’alpinisme, Mecque du freeride, la capitale des Alpes est également un lieu unique, offrant à tout un chacun un cadre exceptionnel au portes de la haute-montagne.;4.0;0.0;4.0;;2019-04-02;2019-04-07;;;
Semaine du cinéma hispanique;Auvergne-Rhône-Alpes;Cinéma et audiovisuel;Cinémas étrangers;63;Annuelle;04 (avril);http://cinehispanique.fr/lassociation;AJ049;CLERMONT FERRAND;;17.0;2002-01-01;oui;;;;;;;;63100;63113;45.7856492991,3.11554542903;CLERMONT FERRAND;63.0;Puy-de-Dôme;;18.0;0.0;4.0;;2019-04-02;2019-04-09;;;
LE SIRK;Bourgogne-Franche-Comté;Musiques actuelles;Musiques amplifiées ou électroniques;21;Annuelle;04 (avril);http://www.riskparty.com;BD066;CHENOVE;Ouges (21);3.0;2016-01-01;;;;;;;;;21300;21166;47.2926136721,5.00488353457;CHENOVE;21.0;Côte-d'Or;4ème édition du festival Le Sirk de Dijon, dédié aux musiques électroniques. Entre house, techno et bass music, le Sirk met à l'honneur les musiques électroniques dancefloor.;4.0;0.0;4.0;;2019-04-02;2019-04-30;;;
DOOINIT FESTIVAL;Bretagne;Musiques actuelles;Musiques amplifiées ou électroniques;35;Annuelle;04 (avril);http://www.dooinit-festival.com;CD075;RENNES;;9.0;2010-01-01;;;;;;;;;35700;35238;48.1119791219,-1.68186449144;RENNES;35.0;Ille-et-Vilaine;10ème édition du festival Dooinit à Rennes;10.0;0.0;4.0;;2019-04-02;2019-04-07;;;
IND'HIP'HOP;Grand Est;Musiques actuelles;Musiques amplifiées ou électroniques;67;Annuelle;04 (avril);https://hiphopinfosfrance.com;FD073;STRASBOURG;;7.0;2012-01-01;;;;;;;;;67100;67482;48.5712679849,7.76752679517;STRASBOURG;67.0;Bas-Rhin;8ème édition;8.0;0.0;4.0;;2019-04-04;2019-04-09;;;
